{
  "schemaVersion": 1,
  "kind": "netplay.session",
  "sessionId": "np-0a1b2c3d-4e5f",
  "state": "created",
  "visibility": "private",
  "role": "host",
  "createdAt": "2026-08-11T12:00:00Z",
  "updatedAt": "2026-08-11T12:00:00Z",
  "game": {
    "platformId": "sfc",
    "gameId": "demo-castlevania-style",
    "romHash": {
      "algorithm": "sha256",
      "digest": "0123456789abcdef0123456789abcdef0123456789abcdef0123456789abcdef"
    },
    "core": {"id": "snes9x", "version": "1.63.0"},
    "saveStateVersion": "1.0",
    "deterministicConfig": {"seed": 7, "clock": "60Hz"},
    "playerCount": 2,
    "controlProfile": "gamepad-classic",
    "region": "ntsc-u"
  },
  "privacy": {
    "peerVisible": ["displayName", "latencyMs", "region", "platformId"],
    "relayVisible": ["sessionId", "byteVolume", "durationMs"]
  }
}
